{"schema":"nrm.customer.assessment_request.v1","messageId":"assess-001","timestamp":"2026-08-13T10:00:00+08:00","source":"CUSTOMER","data":{"taskId":"task-001","sourcePlatformId":"fighter-01","destinationPlatformId":"command-01","businessType":"C2","requiredBandwidthBps":64000,"maximumDelayMs":300,"minimumPdrPercent":90,"allowedNetworks":["LINK16"]}}
